{
  "$schema": "https://json-schema.org/draft/2020-12/schema",
  "description": "Process Concept (OGC 14-065 WPS 2.0.2 \u00a77.5.1): \"high-level documentation about a general group of processes... the purpose, methodology and properties of a process but not the specific input and output parameters... a documentation resource that may be referenced by refined process definitions to document their relation to a common principle.\" Deliberately carries no I/O, no format, no CWL: each generic-profiles.generic-profile.* entry declares the Concept(s) it belongs to (e.g. vector geometry processing, raster coverage processing) as its `broader` concept.",
  "type": "object",
  "required": [
    "id",
    "type",
    "prefLabel",
    "definition",
    "inScheme",
    "status",
    "source"
  ],
  "properties": {
    "id": {
      "type": "string",
      "format": "uri",
      "x-jsonld-id": "@id"
    },
    "type": {
      "const": "Concept",
      "x-jsonld-id": "@type"
    },
    "prefLabel": {
      "type": "string",
      "x-jsonld-id": "http://www.w3.org/2004/02/skos/core#prefLabel"
    },
    "definition": {
      "type": "string",
      "x-jsonld-id": "http://www.w3.org/2004/02/skos/core#definition"
    },
    "inScheme": {
      "type": "string",
      "format": "uri",
      "x-jsonld-id": "http://www.w3.org/2004/02/skos/core#inScheme",
      "x-jsonld-type": "@id"
    },
    "status": {
      "type": "string",
      "enum": [
        "submitted",
        "valid",
        "invalid",
        "superseded",
        "retired"
      ],
      "x-jsonld-id": "https://geolabs.github.io/bblocks-generic-profiles/def/status"
    },
    "source": {
      "type": "array",
      "minItems": 1,
      "items": {
        "type": "object",
        "required": [
          "title"
        ],
        "properties": {
          "title": {
            "type": "string",
            "x-jsonld-id": "http://purl.org/dc/terms/title"
          },
          "link": {
            "type": "string",
            "format": "uri",
            "x-jsonld-id": "http://purl.org/dc/terms/references",
            "x-jsonld-type": "@id"
          },
          "clause": {
            "type": "string",
            "x-jsonld-id": "https://geolabs.github.io/bblocks-generic-profiles/def/clause"
          }
        }
      },
      "x-jsonld-id": "http://purl.org/dc/terms/source"
    },
    "narrower": {
      "type": "array",
      "items": {
        "type": "string",
        "format": "uri"
      },
      "x-jsonld-id": "http://www.w3.org/2004/02/skos/core#narrower",
      "x-jsonld-type": "@id"
    }
  },
  "x-jsonld-extra-terms": {
    "Concept": "http://www.w3.org/2004/02/skos/core#Concept"
  },
  "x-jsonld-prefixes": {
    "skos": "http://www.w3.org/2004/02/skos/core#",
    "gp": "https://geolabs.github.io/bblocks-generic-profiles/def/",
    "dct": "http://purl.org/dc/terms/"
  }
}