{
  "id": "https://geolabs.github.io/bblocks-generic-profiles/def/concept/raster-coverage-processing",
  "type": "Concept",
  "prefLabel": "Raster Coverage Processing",
  "definition": "Operations on raster/coverage data: reprojecting a coverage to another coordinate reference system, deriving a new raster from one or more others via a mathematical expression or a named radiometric index, cropping a coverage to a region of interest, or converting a coverage to another encoding -- independent of any input/output signature or implementation (OGC 14-065 WPS 2.0.2 \u00a77.5.1).",
  "inScheme": "https://geolabs.github.io/bblocks-generic-profiles/def/concept",
  "status": "submitted",
  "source": [
    {
      "title": "ISO 19123-1:2023 Geographic information -- Schema for coverage geometry and functions -- Part 1: Fundamentals"
    },
    {
      "title": "OGC 08-068r2 Web Coverage Processing Service (WCPS) Language Interface Standard",
      "link": "https://www.ogc.org/standards/wcps/"
    }
  ]
}